{
  "bundles": [
    {
      "adapter_backend_id": "yolox",
      "artifact_set_digest": "b911ad07760a54085a087c4107acb83a8cfb08171268e23526855b89b1cb0071",
      "artifacts": [
        {
          "artifact_id": "weights",
          "cache_key": "yolox-s-coco/0.1.1rc0/yolox_s.pth",
          "expected_size_bytes": 72089125,
          "license_expression": "Apache-2.0",
          "license_revision": "eba6c8d511033606eb2798dfa9f12747296db1fc",
          "license_source": "yolozu/data/manifest/model_zoo.json#yolox-s-coco",
          "order": 0,
          "role": "weight",
          "sha256": "f55ded7181e1b0c13285c56e7790b8f0e8f8db590fe4edb37f0b7f345c913a30",
          "source_id": "https://github.com/Megvii-BaseDetection/YOLOX/releases/download/0.1.1rc0/yolox_s.pth",
          "source_revision": "0.1.1rc0"
        }
      ],
      "bundle_id": "yolox-s-coco",
      "bundle_version": "0.1.1rc0",
      "class_vocabulary": {
        "digest": "54d0cd99f88c9dabcb34373f4caba8b82bea3959fe0e4204596db5018710624a",
        "id": "coco-80-v1",
        "labels": [
          "person",
          "bicycle",
          "car",
          "motorcycle",
          "airplane",
          "bus",
          "train",
          "truck",
          "boat",
          "traffic light",
          "fire hydrant",
          "stop sign",
          "parking meter",
          "bench",
          "bird",
          "cat",
          "dog",
          "horse",
          "sheep",
          "cow",
          "elephant",
          "bear",
          "zebra",
          "giraffe",
          "backpack",
          "umbrella",
          "handbag",
          "tie",
          "suitcase",
          "frisbee",
          "skis",
          "snowboard",
          "sports ball",
          "kite",
          "baseball bat",
          "baseball glove",
          "skateboard",
          "surfboard",
          "tennis racket",
          "bottle",
          "wine glass",
          "cup",
          "fork",
          "knife",
          "spoon",
          "bowl",
          "banana",
          "apple",
          "sandwich",
          "orange",
          "broccoli",
          "carrot",
          "hot dog",
          "pizza",
          "donut",
          "cake",
          "chair",
          "couch",
          "potted plant",
          "bed",
          "dining table",
          "toilet",
          "tv",
          "laptop",
          "mouse",
          "remote",
          "keyboard",
          "cell phone",
          "microwave",
          "oven",
          "toaster",
          "sink",
          "refrigerator",
          "book",
          "clock",
          "vase",
          "scissors",
          "teddy bear",
          "hair drier",
          "toothbrush"
        ]
      },
      "execution_binding": {
        "artifact_scope": "fetchable_model_assets",
        "reason_code": "runner_artifact_set_incomplete",
        "status": "unbound"
      },
      "family_id": "yolox",
      "model_revision": "0.1.1rc0",
      "model_source_id": "https://github.com/Megvii-BaseDetection/YOLOX/releases/download/0.1.1rc0/yolox_s.pth",
      "prompt_modes": [
        "fixed_classes"
      ],
      "provenance_class": "existing_code_owned",
      "schema_version": 1,
      "spec_digest": "bbc7923810c1e5ec4dac2d7577b4fa5651c755f619d41d8042f983cd529398ae",
      "tasks": [
        "object_detection"
      ],
      "test_only": false
    },
    {
      "adapter_backend_id": "detectron2",
      "artifact_set_digest": "845f012ea90d6236fd2e9614f317c60df1ff275dae93fa222487a5531430c4bd",
      "artifacts": [
        {
          "artifact_id": "weights",
          "cache_key": "detectron2-faster-rcnn-r50-fpn-1x-coco/137257794/model_final_b275ba.pkl",
          "expected_size_bytes": 167266879,
          "license_expression": "Apache-2.0",
          "license_revision": "eba6c8d511033606eb2798dfa9f12747296db1fc",
          "license_source": "yolozu/data/manifest/model_zoo.json#detectron2-faster-rcnn-r50-fpn-1x-coco",
          "order": 0,
          "role": "weight",
          "sha256": "b6def88fe428c339d60e718c0e9b4d821580df6a92e02435ef439fea8a3a2395",
          "source_id": "https://dl.fbaipublicfiles.com/detectron2/COCO-Detection/faster_rcnn_R_50_FPN_1x/137257794/model_final_b275ba.pkl",
          "source_revision": "137257794"
        }
      ],
      "bundle_id": "detectron2-faster-rcnn-r50-fpn-1x-coco",
      "bundle_version": "137257794",
      "class_vocabulary": {
        "digest": "54d0cd99f88c9dabcb34373f4caba8b82bea3959fe0e4204596db5018710624a",
        "id": "coco-80-v1",
        "labels": [
          "person",
          "bicycle",
          "car",
          "motorcycle",
          "airplane",
          "bus",
          "train",
          "truck",
          "boat",
          "traffic light",
          "fire hydrant",
          "stop sign",
          "parking meter",
          "bench",
          "bird",
          "cat",
          "dog",
          "horse",
          "sheep",
          "cow",
          "elephant",
          "bear",
          "zebra",
          "giraffe",
          "backpack",
          "umbrella",
          "handbag",
          "tie",
          "suitcase",
          "frisbee",
          "skis",
          "snowboard",
          "sports ball",
          "kite",
          "baseball bat",
          "baseball glove",
          "skateboard",
          "surfboard",
          "tennis racket",
          "bottle",
          "wine glass",
          "cup",
          "fork",
          "knife",
          "spoon",
          "bowl",
          "banana",
          "apple",
          "sandwich",
          "orange",
          "broccoli",
          "carrot",
          "hot dog",
          "pizza",
          "donut",
          "cake",
          "chair",
          "couch",
          "potted plant",
          "bed",
          "dining table",
          "toilet",
          "tv",
          "laptop",
          "mouse",
          "remote",
          "keyboard",
          "cell phone",
          "microwave",
          "oven",
          "toaster",
          "sink",
          "refrigerator",
          "book",
          "clock",
          "vase",
          "scissors",
          "teddy bear",
          "hair drier",
          "toothbrush"
        ]
      },
      "execution_binding": {
        "artifact_scope": "fetchable_model_assets",
        "reason_code": "runner_artifact_set_incomplete",
        "status": "unbound"
      },
      "family_id": "detectron2",
      "model_revision": "137257794",
      "model_source_id": "https://dl.fbaipublicfiles.com/detectron2/COCO-Detection/faster_rcnn_R_50_FPN_1x/137257794/model_final_b275ba.pkl",
      "prompt_modes": [
        "fixed_classes"
      ],
      "provenance_class": "existing_code_owned",
      "schema_version": 1,
      "spec_digest": "b271feae2b588d1b2686db77eee7d3522de4adabdf64a09c08a8aaeb27499750",
      "tasks": [
        "object_detection"
      ],
      "test_only": false
    },
    {
      "adapter_backend_id": "mmdetection",
      "artifact_set_digest": "1c213d574d305f532fdfc998dedb6ac98ae0b03f5f62bb971ac6517d212ff096",
      "artifacts": [
        {
          "artifact_id": "weights",
          "cache_key": "mmdet-faster-rcnn-r50-fpn-1x-coco/20200130-047c8118/faster_rcnn_r50_fpn_1x_coco_20200130-047c8118.pth",
          "expected_size_bytes": 167287506,
          "license_expression": "Apache-2.0",
          "license_revision": "eba6c8d511033606eb2798dfa9f12747296db1fc",
          "license_source": "yolozu/data/manifest/model_zoo.json#mmdet-faster-rcnn-r50-fpn-1x-coco",
          "order": 0,
          "role": "weight",
          "sha256": "047c8118fc5ca88ba5ae1fab72f2cd6b070501fe3af2f3cba5cfa9a89b44b03e",
          "source_id": "https://download.openmmlab.com/mmdetection/v2.0/faster_rcnn/faster_rcnn_r50_fpn_1x_coco/faster_rcnn_r50_fpn_1x_coco_20200130-047c8118.pth",
          "source_revision": "20200130-047c8118"
        }
      ],
      "bundle_id": "mmdet-faster-rcnn-r50-fpn-1x-coco",
      "bundle_version": "20200130-047c8118",
      "class_vocabulary": {
        "digest": "54d0cd99f88c9dabcb34373f4caba8b82bea3959fe0e4204596db5018710624a",
        "id": "coco-80-v1",
        "labels": [
          "person",
          "bicycle",
          "car",
          "motorcycle",
          "airplane",
          "bus",
          "train",
          "truck",
          "boat",
          "traffic light",
          "fire hydrant",
          "stop sign",
          "parking meter",
          "bench",
          "bird",
          "cat",
          "dog",
          "horse",
          "sheep",
          "cow",
          "elephant",
          "bear",
          "zebra",
          "giraffe",
          "backpack",
          "umbrella",
          "handbag",
          "tie",
          "suitcase",
          "frisbee",
          "skis",
          "snowboard",
          "sports ball",
          "kite",
          "baseball bat",
          "baseball glove",
          "skateboard",
          "surfboard",
          "tennis racket",
          "bottle",
          "wine glass",
          "cup",
          "fork",
          "knife",
          "spoon",
          "bowl",
          "banana",
          "apple",
          "sandwich",
          "orange",
          "broccoli",
          "carrot",
          "hot dog",
          "pizza",
          "donut",
          "cake",
          "chair",
          "couch",
          "potted plant",
          "bed",
          "dining table",
          "toilet",
          "tv",
          "laptop",
          "mouse",
          "remote",
          "keyboard",
          "cell phone",
          "microwave",
          "oven",
          "toaster",
          "sink",
          "refrigerator",
          "book",
          "clock",
          "vase",
          "scissors",
          "teddy bear",
          "hair drier",
          "toothbrush"
        ]
      },
      "execution_binding": {
        "artifact_scope": "fetchable_model_assets",